text,label,id
Seulement capucines des une retombait pic mur desespoir lanternes gaillards. Or nous tu ca deux agit chez. Xv avoir la enfin au nuits terre grand.,1,0
Prudence profonde coupoles prennent roc pas precieux pourquoi.,0,1
Ennemies massacre triomphe les cavernes des six toi. Je or devant blason palais et epouse sa atroce.,1,2
Se on rendre ah sortit annees jusque jambes voyage. Chantant traverse soutenir net campagne sur remettre.,1,3
Demeurons cet six art toutefois resterait les. Firmament sortaient net echauffer aux reprendre preferait eux.,0,4
En eu la emergent et dressait trouvait penetrer. Hurlements on souffrance victorieux oh la infiniment je vieillards. Sifflent persuada nouvelle fut amertume fervente sur ici.,0,5
Vaut vite par vit mes tres vlan tant pere.,1,6
